{
  "runId": "run-junichiro-v1",
  "projectId": "junichiro-jackson",
  "attempt": 1,
  "researchVersion": 1,
  "status": "complete",
  "currentStage": 6,
  "completedStages": [1, 2, 3, 4, 5, 6],
  "missingStages": [],
  "publicFailureMessage": null,
  "projectSlug": "junichiro-jackson",
  "cardUrl": "/projects/junichiro-jackson",
  "retryEligible": true,
  "fallbackUsed": false,
  "updatedAt": "2026-08-26T12:05:00Z"
}
